statement ok
CREATE TABLE users (
    id INTEGER,
    name TEXT,
    age INTEGER
)

statement ok
INSERT INTO users VALUES (1, 'Alice', 25)

statement ok
INSERT INTO users VALUES (2, 'Bob', 30)

statement ok
INSERT INTO users VALUES (3, 'Charlie', 35)

query ITI rowsort
SELECT * FROM users
----
1 Alice 25
2 Bob 30
3 Charlie 35

query T
SELECT name FROM users WHERE age > 25
----
Bob
Charlie

query I
SELECT COUNT(*) FROM users
----
3

query I
SELECT MAX(age) FROM users
----
35

statement ok
UPDATE users SET age = 26 WHERE name = 'Alice'

query I
SELECT age FROM users WHERE name = 'Alice'
----
26

statement ok
DELETE FROM users WHERE age = 30

query I
SELECT COUNT(*) FROM users
----
2

statement ok
DROP TABLE users
